"benjamin_0001kc9_agt","pressure","1","0","1","0","\b(acusad|delata[dr])[^\s]+","Skype Business - Conversacion con Luis Salazar","delatar","hay que tener mucho cuidado nos pueden delatar si compartimos esto con muchas personas"
"benjamin_0001kc9_agt","pressure","1","0","1","0","\b(castig|conden)[^\s]+","Microsoft PowerPoint - Presentacion estado del proyecto SAP.pptx","castigo","si no se cumplen las metas habra como castigo el no pago de las comisiones"
"benjamin_0001kc9_agt","pressure","1","0","1","0","\b(atemoriz|temeros)[^\s]+","Microsoft Project - Proyecto construccion casa.mpp","temeroso","estoy temeroso de no poder cumplir por los problemas presentados en la obra"
"benjamin_0001kc9_agt","pressure","1","0","1","0","\baburri[^\s]+","Microsoft Excel - Estados financieros.xlsx","aburrido","esto me tiene muy aburrido porque no estoy de acuerdo con enviar asi los estados financieros siempre"
"benjamin_0001kc9_agt","pressure","1","0","1","0","\baisla[dm][^\s]+","Skype Business - Conversacion con Noel Medina","aislados","para que sepan que nos tienen aislados trabajando solo en eso por orden de la presidencia"
"benjamin_0001kc9_agt","pressure","1","0","1","0","\baniquil[^\s]+","WhatsApp Web - Chat con Luisa Miranda","aniquilar","a todos ellos los van a aniquilar manana y yo no quiero estar mas en ese grupito de personas"
"benjamin_0001kc9_agt","pressure","1","0","1","0","\baplast[^\s]+","Gmail Inbox - Bandeja de correo no deseado","aplastar","dijo que si el queria me podia aplastar como persona y como profesional que tuviera mucha prudencia"
"benjamin_0001kc9_agt","opportunity","1","1","0","0","\begolatr[^\s]+","Skype Business - Conversacion con Luis Salazar","ogolatria","hay que aprovechar esa egolatria que tiene el jefe para poder hacer nuestras cosas"
"benjamin_0001kc9_agt","opportunity","1","1","0","0","\bdisturbi[^\s]+","Microsoft Excel - Informe preliminar proyecto SAP.xlsx","disturbios","podemos generar disturbios y asi desviamos la atencion de lo que esta sucediendo"
"benjamin_0001kc9_agt","opportunity","1","1","0","0","\bdestru[^\s]+","Microsoft Word - Carta de inconformidad.docx","destruir","se puede destruir el comprobante y decimos luego que se perdio o lo cambiamos por otro"
"benjamin_0001kc9_agt","opportunity","1","1","0","0","\bdescomp[^\s]+","Microsoft PowerPoint - Presentacion estado del proyecto SAP.pptx","descompuesto","simulamos que el sistema esta descompuesto y asi podemos ganar tiempo"
"benjamin_0001kc9_agt","opportunity","1","1","0","0","\bcontamin[^\s]+","WhatsApp Web - Chat con Felipe Morales","contaminar","ellos dicen que si lo juntan con nosotros lo vamos a contaminar y eso debemos manejarlo muy bien"
"benjamin_0001kc9_agt","opportunity","1","1","0","0","\bmanipul[^\s]+","Microsoft Project - Proyecto construccion casa.mpp","manipulando","eso lo logramos manipulando el sistema y modificando la relacion de gastos al dia"
"benjamin_0001kc9_agt","opportunity","1","1","0","0","\b(atac|ataqu)[^\s]+","Microsoft Word - Resumen de incidencias.docx","atacar","podemos atacar el hecho de que no existen pruebas y decimos que las modificaron ayer"
"benjamin_0001kc9_agt","rationalization","1","0","0","1","\b(vergon|verguenz)[^\s]+","WhatsApp Web - Chat con Felipe Morales","verguenza","no le dio verguenza no pagarnos la comision que nos prometio desde un principio"
"benjamin_0001kc9_agt","rationalization","1","0","0","1","\bviciad[^\s]+","Microsoft Project - Proyecto construccion casa.mpp","viciado","el proceso desde un principio esta viciado por eso procedimos de acuerdo al manual"
"benjamin_0001kc9_agt","rationalization","1","0","0","1","\bsadi[cs][^\s]+","Microsoft Word - Carta secretaria.docx","sadico","es que al momento de decir eso fue hasta sadico el senor y no se le dio nada que yo estuviera"
"benjamin_0001kc9_agt","rationalization","1","0","0","1","\btiran[^\s]+","Microsoft Outlook - Redactar correo","tirano","se hizo todo asi porque el jefe es un tirano con nosotros y esos son los resultados de su pesima gestion"
"benjamin_0001kc9_agt","rationalization","1","0","0","1","\bvag[ao][^\s]+","Microsoft Excel - Estados financieros.xlsx","vago","esos estados quedaron asi de malos por el vago de Fernando que no pudo reunirse a tiempo"
"benjamin_0001kc9_agt","rationalization","1","0","0","1","\bvandal[^\s]+","Microsoft PowerPoint - Presentación junta directiva.pptx","vandalismo","apelamos al vandalismo pero porque la situacion que se presento lo ameritaba"
"benjamin_0001kc9_agt","rationalization","1","0","0","1","\brepulsiv[^\s]+","Microsoft Word - Carta aumento de salario.docx","repulsivo","fue demasiado repulsivo cuando le solicite el pago de mis comisiones por eso lo hice"
"benjamin_0001kc9_agt","rationalization","1","0","0","1","\bresenti[dm][^\s]+","Microsoft Project - Cronograma proyecto SAP.mpp","resentimiento","fue por puro y fisico resentimiento con la entidad porque no me pagaron bien"
"benjamin_0001kc9_agt","rationalization","1","0","0","1","\binconscien[^\s]+","Skype Business - Conversacion con Noel Medina","inconsciente","es un inconsciente de que uno tiene tambien necesidades basicas y necesita cubrirlas"
"benjamin_0001kc9_agt","rationalization","1","0","0","1","\brepugnan[^\s]+","WhatsApp Web - Chat con Luisa Miranda","repugnante","el trato que nos dieron en ese departamento fue repugnante y el jefe que estaba alli de lo peor"
"benjamin_0001kc9_agt","rationalization","1","0","0","1","\bmigaj[^\s]+","Gmail Inbox - Bandeja de correo no deseado","migajas","ellos no se van a dar cuenta puesto que son migajas y como tal son muy pequenas en comparacion"