"jason_j8g12cg_agt","pressure","1","0","1","0","\b(no alcanza( ni)? para( el| la| los| un(os)?)? (almuerzos?|comidas?|gaseosas?|dulces?))\b","Microsoft Excel - Estados financieros.xlsx","no alcanza para la gaseosa","lo que puedo sacar no alcanza para la gaseosa"
"jason_j8g12cg_agt","pressure","1","0","1","0","\b(cuanto (vale|valia) (su|mi) silencio)\b","Skype Business - Conversacion con Noel Medina","cuanto vale su silencio","digame cuanto vale su silencio y hacemos el procedimiento que le vengo diciendo"
"jason_j8g12cg_agt","pressure","1","0","1","0","\b((usted(es)?|el|ell[ao]s?) (no|nunca) (saben?|sup(e|o|ieron)) nada)\b","WhatsApp Web - Chat con Luisa Miranda","usted no sabe nada","si le preguntan cualquier cosa dice que usted no sabe nada de eso"
"jason_j8g12cg_agt","pressure","1","0","1","0","\b((evita(r|ndo)|evadi(r|endo)|enganar) (las?|el|al) auditor(ias?|as?)?)\b","Gmail Inbox - Bandeja de correo no deseado","evadir la auditoria","vamos a ver si es posible evadir la auditoria del martes"
"jason_j8g12cg_agt","pressure","1","0","1","0","\b(estoy bajo( muchas?)? (presion(es)?|tension(es)?))\b","Google Search - Como desprestigiar a mi jefe","estoy bajo mucha presion","necesito hacerlo porque estoy bajo mucha presion en este puesto de trabajo"
"jason_j8g12cg_agt","pressure","1","0","1","0","\b((nos|me|l[oa]s?) tienen (chuzad[oa]s?|vigilad[oa]s?))\b","Google Search - Como hackear un correo electronico","me tienen chuzado","como averiguo si me tienen chuzado porque tengo muchas sospechas de eso"
"jason_j8g12cg_agt","pressure","1","0","1","0","\b(vacaciones( son| son muy)? (costosas|caras))\b","Skype Business - Conversacion con Maria Cifuentes","vacaciones muy costosas","las que quiero son vacaciones muy costosas y tengo que pensarlo muy bien"
"jason_j8g12cg_agt","pressure","1","0","1","0","\b((el|l[oa]s?) auditor(ia|[ea]s?)?( me| nos| le)? estan?( respirando)? (encima|en el cuello))\b","Skype Business - Conversacion con Noel Medina","el auditor esta encima","cuidado que el auditor esta encima de mi"
"jason_j8g12cg_agt","pressure","1","0","1","0","\b((mi|la) situacion es(ta)? (critica|dificil|dura|imposible))\b","Google Search - Como borrar archivos definitivamente","mi situacion es critica","debo averiguarlo rapido porque mi situacion es critica"
"jason_j8g12cg_agt","pressure","1","0","1","0","\b((cumple|cumpli[ro]|cumplieron) dentro (del|los) plazos?)\b","Microsoft Word - Listado de proveedores ultimo semestre.docx","cumplir dentro del plazo","tengo que hacerlo porque hay que cumplir dentro del plazo"
"jason_j8g12cg_agt","pressure","1","0","1","0","\b(l[oa]s? necesito como sea)\b","Google Search - Como ganar mas dinero facil y rapido","lo necesito como sea","estoy investigando maneras de ganar dinero rapido y ese truco lo necesito como sea"
"jason_j8g12cg_agt","pressure","1","0","1","0","\b(vigilan (el|los) tiempos?)\b","Skype Business - Chat con Julio Andres Monsalve","vigilan el tiempo","hay que tener mucho cuidado porque supe que aqui vigilan el tiempo y lo pueden descubrir haciendo cosas"
"jason_j8g12cg_agt","rationalization","1","0","0","1","\b((ell[oa]s?|el) tambien roban?)\b","Microsoft PowerPoint - Presentacion estado del proyecto SAP.pptx","ellos tambien roban","en el proyecto hicimos eso porque ellos tambien roban sin afectar a nadie"
"jason_j8g12cg_agt","rationalization","1","0","0","1","\b((ajust[oa]|complet[oa])( para)? (el|la) (mercado|arriendo|pension|matricula|cuota))\b","WhatsApp Web - Chat con Felipe Morales","ajusto para el mercado","con eso ajusto para el mercado de esta semana"
"jason_j8g12cg_agt","rationalization","1","0","0","1","\b(por una buena causa)\b","Microsoft Project - Proyecto construccion casa.mpp","por una buena causa","yo me le mido a hacerlo porque me parece que todo es por una buena causa y no afecta a nadie"
"jason_j8g12cg_agt","rationalization","1","0","0","1","\b((merezco|necesito|quiero|deseo) (una?|el) (sueldo|compensacion|salario|pag[oa]|ingreso)( mas)? (alt[oa]|elevad[oa]|mayor))\b","Notepad - Carta salario.docx","deseo un sueldo alto","deseo un sueldo alto"
"jason_j8g12cg_agt","rationalization","1","0","0","1","\b(la venganza es dulce)\b","Microsoft Outlook - Redactar correo","la venganza es dulce","me hicieron mucho mal en el pasado ahora debo decirles que la venganza es dulce y me toca reclamar lo mio"
"jason_j8g12cg_agt","rationalization","1","0","0","1","\b(es[ae] (plata|platica|dinero)( me| nos)? cae bien)\b","Microsoft Excel - Estados financieros.xlsx","esa plata nos cae bien","despues de revisar bajo ese concepto esa plata nos cae bien a todos"
"jason_j8g12cg_agt","rationalization","1","0","0","1","\b((merezco|merecemos) mucho mas)\b","Microsoft PowerPoint - Presentación junta directiva.pptx","merezco mucho mas","a la junta directiva le hago saber que yo merezco mucho mas de lo que me pagan ahora"
"jason_j8g12cg_agt","rationalization","1","0","0","1","\b(sali(r|mos|endo) de la (ruina|quiebra|pobreza|miseria))\b","Microsoft Word - Carta aumento de salario.docx","salir de la ruina","les solicito un aumento de salario con el fin de salir de la ruina"
"jason_j8g12cg_agt","rationalization","1","0","0","1","\b((manada|partida) de corruptos)\b","Microsoft Project - Cronograma proyecto SAP.mpp","partida de corruptos","si esa partida de corruptos hace eso y nadie dice nada entonces yo puedo hacer lo mismo"
"burgundy_18hg4cj_agt","pressure","1","0","1","0","\b((cumple|cumpli[ro]|cumplieron) dentro (del|los) plazos?)\b","Microsoft Word - Listado de proveedores ultimo semestre.docx","cumplir dentro del plazo","tengo que hacerlo porque hay que cumplir dentro del plazo"
"burgundy_18hg4cj_agt","pressure","1","0","1","0","\b(l[oa]s? necesito como sea)\b","Google Search - Como ganar mas dinero facil y rapido","lo necesito como sea","estoy investigando maneras de ganar dinero rapido y ese truco lo necesito como sea"
"burgundy_18hg4cj_agt","pressure","1","0","1","0","\b(vigilan (el|los) tiempos?)\b","Skype Business - Chat con Julio Andres Monsalve","vigilan el tiempo","hay que tener mucho cuidado porque supe que aqui vigilan el tiempo y lo pueden descubrir haciendo cosas"
"burgundy_18hg4cj_agt","pressure","1","0","1","0","\b(conflictos? de interes(es)?)\b","WhatsApp Web - Chat con Felipe Andres Zuniga","conflicto de intereses","se puede hacer lo que me estas diciendo pero eso me generaria un conflicto de intereses aqui"
"burgundy_18hg4cj_agt","pressure","1","0","1","0","\b((anadir(le)?|poner(le)?|agregar(le)?)( mas)? lena al fuego)\b","Microsoft Outlook - Bandeja de entrada","meterle mas lena al fuego","eso seria como meterle mas lena al fuego deje eso quieto no diga nada"
"burgundy_18hg4cj_agt","pressure","1","0","1","0","\b(estan? (espiando|esculcando))\b","Microsoft Project - Cronograma ajustado proyecto Azul.mpp","estan espiando","los directores del proyecto estan espiando a los trabajadores para ver lo que hacen"
"burgundy_18hg4cj_agt","pressure","1","0","1","0","\b(problemas? (con|de)( la| el| un| mi)? (familia|espos[oa]|novi[oa]|hij[oa]))\b","Microsoft Excel - Resumen de finanzas personales.xlsx","problemas con la familia","he tenido problemas con la familia"
"burgundy_18hg4cj_agt","pressure","1","0","1","0","\b((nos|me|l[oa]s?) tienen (chuzad[oa]s?|vigilad[oa]s?))\b","Skype Business - Conversacion con Juan Pablo Cifuentes","me tienen vigilado","me tienen vigilado desde que entro hasta que salgo del trabajo"
"burgundy_18hg4cj_agt","pressure","1","0","1","0","\b(maneje[ns]? las? situacion(es)? con( much[ao])? (cuidado|sigilo|prudencia|delicadeza))\b","Yahoo Preguntas - Mi jefe el sapo","maneje la situacion con mucha prudencia","maneje la situacion con mucha prudencia"
"burgundy_18hg4cj_agt","opportunity","1","1","0","0","\b(ganancias? extraordinarias?)\b","WhatsApp Web - Chat con Felipe Morales","ganancias extraordinarias","si lo piensas bien eso generaria unas ganancias extraordinarias aparte del ingreso que tienes"
"burgundy_18hg4cj_agt","opportunity","1","1","0","0","\b(coman?( pero)? callados?)\b","Microsoft Project - Proyecto construccion casa.mpp","coma callado","aqui detallo los excedentes que se perdieron pero coma callado y no diga el sitio donde se encuentran"
"burgundy_18hg4cj_agt","opportunity","1","1","0","0","\b((met(er|ele|anle)( mucho| mas| bastante)? ruido))\b","Microsoft Word - Resumen de incidencias.docx","meter mas ruido","puede usar la estrategia de meter mas ruido para desviar la atencion de lo nuestro"
"burgundy_18hg4cj_agt","opportunity","1","1","0","0","\b(que( se)? parezcan?( un)? error(es)?)\b","Microsoft Word - Carta secretaria.docx","que parezca un error","y se puede hacer de tal forma que parezca un error y si algo pasa nos excusamos y lo corregimos"
"burgundy_18hg4cj_agt","opportunity","1","1","0","0","\b(cierren? la (boca|jeta))\b","Microsoft Outlook - Redactar correo","cierre la boca","necesito que cierre la boca para poder encargarme del procedimiento sin tener ningun problema en el departamento"
"burgundy_18hg4cj_agt","opportunity","1","1","0","0","\b(comision(es)? por( el| los| sus)? (servicios?|contratos?|favor(es)?))\b","Microsoft Excel - Estados financieros.xlsx","comision por el servicio","luego le pedimos una comision por el servicio prestado"
"burgundy_18hg4cj_agt","opportunity","1","1","0","0","\b((tragaron|trago)( todo)? el cuento)\b","Microsoft PowerPoint - Presentación junta directiva.pptx","tragaron todo el cuento","despues de que me preguntaron les explique y se tragaron todo el cuento"
"burgundy_18hg4cj_agt","opportunity","1","1","0","0","\b((mover|poner) el billete)\b","Microsoft Word - Carta aumento de salario.docx","mover el billete","cuando tengamos la oportunidad de mover el billete lo hacemos a una cuenta que abri en el exterior"
"burgundy_18hg4cj_agt","opportunity","1","1","0","0","\b((trabaj(o|ito|ote)s?) especial(es)?)\b","Microsoft Project - Cronograma proyecto SAP.mpp","trabajo especial","le tengo un trabajo especial es una oportunidad unica y muy importante para usted"
"burgundy_18hg4cj_agt","rationalization","1","0","0","1","\b(es[ae] (plata|platica|dinero)( me| nos)? cae bien)\b","Microsoft Excel - Estados financieros.xlsx","esa plata nos cae bien","despues de revisar bajo ese concepto esa plata nos cae bien a todos"
"burgundy_18hg4cj_agt","rationalization","1","0","0","1","\b((merezco|merecemos) mucho mas)\b","Microsoft PowerPoint - Presentación junta directiva.pptx","merezco mucho mas","a la junta directiva le hago saber que yo merezco mucho mas de lo que me pagan ahora"
"burgundy_18hg4cj_agt","rationalization","1","0","0","1","\b(sali(r|mos|endo) de la (ruina|quiebra|pobreza|miseria))\b","Microsoft Word - Carta aumento de salario.docx","salir de la ruina","les solicito un aumento de salario con el fin de salir de la ruina"
"burgundy_18hg4cj_agt","rationalization","1","0","0","1","\b((manada|partida) de corruptos)\b","Microsoft Project - Cronograma proyecto SAP.mpp","partida de corruptos","si esa partida de corruptos hace eso y nadie dice nada entonces yo puedo hacer lo mismo"
"burgundy_18hg4cj_agt","rationalization","1","0","0","1","\b((compens(ar|o|an?)|indemniza[nr]) (las?|el|los) (perdidas?|descuadres?|abusos?|salarios?))\b","Skype Business - Conversacion con Noel Medina","compensar la perdida","hay que compensar la perdida"
"burgundy_18hg4cj_agt","rationalization","1","0","0","1","\b(derecho (las?|unas?) indemnizacion(es)?)\b","WhatsApp Web - Chat con Luisa Miranda","derecho a la indemnizacion","les pienso decir que yo tengo derecho a la indemnizacion o me llevo los insumos"
"burgundy_18hg4cj_agt","rationalization","1","0","0","1","\b((poco|nada) etic[oa]s?)\b","Gmail Inbox - Bandeja de correo no deseado","poco eticos","las personas que trabajan aqui son poco eticas y nadie les dice nada a mi que no me vengan a decir algo"
"benjamin_0001kc9_agt","pressure","1","0","1","0","\b((evita(r|ndo)|evadi(r|endo)|enganar) (las?|el|al) auditor(ias?|as?)?)\b","Gmail Inbox - Bandeja de correo no deseado","evadir la auditoria","vamos a ver si es posible evadir la auditoria del martes"
"benjamin_0001kc9_agt","pressure","1","0","1","0","\b(estoy bajo( muchas?)? (presion(es)?|tension(es)?))\b","Google Search - Como desprestigiar a mi jefe","estoy bajo mucha presion","necesito hacerlo porque estoy bajo mucha presion en este puesto de trabajo"
"benjamin_0001kc9_agt","pressure","1","0","1","0","\b((nos|me|l[oa]s?) tienen (chuzad[oa]s?|vigilad[oa]s?))\b","Google Search - Como hackear un correo electronico","me tienen chuzado","como averiguo si me tienen chuzado porque tengo muchas sospechas de eso"
"benjamin_0001kc9_agt","pressure","1","0","1","0","\b(vacaciones( son| son muy)? (costosas|caras))\b","Skype Business - Conversacion con Maria Cifuentes","vacaciones muy costosas","las que quiero son vacaciones muy costosas y tengo que pensarlo muy bien"
"benjamin_0001kc9_agt","pressure","1","0","1","0","\b((el|l[oa]s?) auditor(ia|[ea]s?)?( me| nos| le)? estan?( respirando)? (encima|en el cuello))\b","Skype Business - Conversacion con Noel Medina","el auditor esta encima","cuidado que el auditor esta encima de mi"
"benjamin_0001kc9_agt","pressure","1","0","1","0","\b((mi|la) situacion es(ta)? (critica|dificil|dura|imposible))\b","Google Search - Como borrar archivos definitivamente","mi situacion es critica","debo averiguarlo rapido porque mi situacion es critica"
"benjamin_0001kc9_agt","pressure","1","0","1","0","\b((cumple|cumpli[ro]|cumplieron) dentro (del|los) plazos?)\b","Microsoft Word - Listado de proveedores ultimo semestre.docx","cumplir dentro del plazo","tengo que hacerlo porque hay que cumplir dentro del plazo"
"benjamin_0001kc9_agt","opportunity","1","1","0","0","\b((met(er|ele|anle)( mucho| mas| bastante)? ruido))\b","Microsoft Word - Resumen de incidencias.docx","meter mas ruido","puede usar la estrategia de meter mas ruido para desviar la atencion de lo nuestro"
"benjamin_0001kc9_agt","opportunity","1","1","0","0","\b(que( se)? parezcan?( un)? error(es)?)\b","Microsoft Word - Carta secretaria.docx","que parezca un error","y se puede hacer de tal forma que parezca un error y si algo pasa nos excusamos y lo corregimos"
"benjamin_0001kc9_agt","opportunity","1","1","0","0","\b(cierren? la (boca|jeta))\b","Microsoft Outlook - Redactar correo","cierre la boca","necesito que cierre la boca para poder encargarme del procedimiento sin tener ningun problema en el departamento"
"benjamin_0001kc9_agt","opportunity","1","1","0","0","\b(comision(es)? por( el| los| sus)? (servicios?|contratos?|favor(es)?))\b","Microsoft Excel - Estados financieros.xlsx","comision por el servicio","luego le pedimos una comision por el servicio prestado"
"benjamin_0001kc9_agt","opportunity","1","1","0","0","\b((tragaron|trago)( todo)? el cuento)\b","Microsoft PowerPoint - Presentación junta directiva.pptx","tragaron todo el cuento","despues de que me preguntaron les explique y se tragaron todo el cuento"
"benjamin_0001kc9_agt","opportunity","1","1","0","0","\b((mover|poner) el billete)\b","Microsoft Word - Carta aumento de salario.docx","mover el billete","cuando tengamos la oportunidad de mover el billete lo hacemos a una cuenta que abri en el exterior"
"benjamin_0001kc9_agt","opportunity","1","1","0","0","\b((trabaj(o|ito|ote)s?) especial(es)?)\b","Microsoft Project - Cronograma proyecto SAP.mpp","trabajo especial","le tengo un trabajo especial es una oportunidad unica y muy importante para usted"
"benjamin_0001kc9_agt","rationalization","1","0","0","1","\b(sali(r|mos|endo) de la (ruina|quiebra|pobreza|miseria))\b","Microsoft Word - Carta aumento de salario.docx","salir de la ruina","les solicito un aumento de salario con el fin de salir de la ruina"
"benjamin_0001kc9_agt","rationalization","1","0","0","1","\b((manada|partida) de corruptos)\b","Microsoft Project - Cronograma proyecto SAP.mpp","partida de corruptos","si esa partida de corruptos hace eso y nadie dice nada entonces yo puedo hacer lo mismo"
"benjamin_0001kc9_agt","rationalization","1","0","0","1","\b((compens(ar|o|an?)|indemniza[nr]) (las?|el|los) (perdidas?|descuadres?|abusos?|salarios?))\b","Skype Business - Conversacion con Noel Medina","compensar la perdida","hay que compensar la perdida"
"benjamin_0001kc9_agt","rationalization","1","0","0","1","\b(derecho (las?|unas?) indemnizacion(es)?)\b","WhatsApp Web - Chat con Luisa Miranda","derecho a la indemnizacion","les pienso decir que yo tengo derecho a la indemnizacion o me llevo los insumos"
"benjamin_0001kc9_agt","rationalization","1","0","0","1","\b((poco|nada) etic[oa]s?)\b","Gmail Inbox - Bandeja de correo no deseado","poco eticos","las personas que trabajan aqui son poco eticas y nadie les dice nada a mi que no me vengan a decir algo"
"benjamin_0001kc9_agt","rationalization","1","0","0","1","\b((hay|tienen?) que (avispar(se)?|ser avispad[oa]s?))\b","Google Search - Como desprestigiar a mi jefe","hay que avisparse","en este mundo hay que avisparse porque el vivo vive del bobo hoy en dia"
"benjamin_0001kc9_agt","rationalization","1","0","0","1","\b(abuso de (poder|autoridad))\b","Google Search - Como hackear un correo electronico","abuso de poder","lo unico que hay en esta empresa es un abuso de poder exagerado contra todos nosotros"
"benjamin_0001kc9_agt","rationalization","1","0","0","1","\b(nadie se va( dar)? (cuenta|enterar))\b","Skype Business - Conversacion con Maria Cifuentes","nadie se va a dar cuenta","ademas no importa por que nadie se va a dar cuenta del faltante tan rapido"
"benjamin_0001kc9_agt","rationalization","1","0","0","1","\b((nadie|quien(es)?) les? importa)\b","Microsoft Word - Modulares defectuosos.docx","nadie le importa","proceda de esa manera a nadie le importa que los modulares salgan defectuosos de fabrica"
"benjamin_0001kc9_agt","rationalization","1","0","0","1","\b((ell[oa]s?|el) tambien roban?)\b","Skype Business - Conversacion con Noel Medina","ella tambien roba","no tienen el derecho y no me pueden decir nada porque ella tambien roba desde que entro"
"benjamin_0001kc9_agt","rationalization","1","0","0","1","\b(por una buena causa)\b","Google Search - Como borrar archivos definitivamente","por una buena causa","necesito borrar definitivamente unos archivos de forma segura y es por una buena causa"